{
  "$schema": "../../../../registry-item-schema.json",
  "name": "logo-text",
  "type": "registry:ui",
  "title": "Logo Text",
  "description": "Logo text component with gradient styling",
  "categories": [
    "ui",
    "branding"
  ],
  "files": [
    {
      "path": "components/ui/LogoText.vue",
      "type": "registry:ui"
    }
  ],
  "dependencies": [
    "reka-ui"
  ],
  "registryDependencies": [
    "utils"
  ]
}
