{
  "$schema": "../../../../registry-item-schema.json",
  "name": "utils",
  "type": "registry:lib",
  "title": "Utils",
  "description": "Utility functions for class name merging and conditional styling",
  "categories": [
    "lib",
    "utils"
  ],
  "files": [
    {
      "path": "lib/utils.ts",
      "type": "registry:lib"
    }
  ],
  "dependencies": [
    "clsx",
    "tailwind-merge",
    "@tanstack/vue-table"
  ],
  "registryDependencies": []
}
