{
  "$schema": "../../../../registry-item-schema.json",
  "name": "dark-mode",
  "type": "registry:feature",
  "title": "Dark Mode",
  "description": "Dark mode toggle component with smooth icon transitions and composable for theme management",
  "categories": [
    "feature",
    "ui"
  ],
  "files": [
    {
      "path": "shared/components/DarkModeToggle.vue",
      "type": "registry:ui"
    },
    {
      "path": "shared/composables/useDarkMode.ts",
      "type": "registry:lib"
    }
  ],
  "dependencies": [
    "@vueuse/core",
    "lucide-vue-next"
  ],
  "registryDependencies": [
    "button"
  ]
}
